<?xml version="1.0" encoding="ISO-8859-1"?>
<!DOCTYPE universe SYSTEM "doctypes/dtdUniverse.dtd">
<universe version="1.0">
    <content>
        <background src="texture3.jpg"/>
        <limits>
            <width>10.0</width>
            <height>15.0</height>
            <deepness>15.0</deepness>
            <thickness>0.05</thickness>
            <appearance>
                <material>
                    <ambient>1.0, 0.0, 1.0</ambient>
                    <emissive>0.0, 0.0, 0.0</emissive>
                    <diffuse>0.37, 0.37, 0.37</diffuse>
                    <specular>0.89, 0.89, 0.89</specular>
                    <shininess>1.0</shininess>
                </material>
            </appearance>
        </limits>
        <light type="ambient">
            <color>0.2, 1.0, 0.8</color>
            <position>0.0, 0.0, 0.0</position>
            <attenuation>0.0, 0.0, 0.0</attenuation>
        </light>
        <light type="directional">
            <color>0.6, 1.0, 0.2</color>
            <direction>0.0, 0.0, 0.0</direction>
        </light>
        <light type="point">
            <color>1.0, 1.0, 0.4</color>
            <position>1.0, 1.0, 1.0</position>
            <attenuation>1.0, 0.0, 0.0</attenuation>
        </light>
        <object src="designs\Flecha.dae" type="furniture">
            <scale>1.0</scale>
            <location>1.0, 2.0, 1.0</location>
            <rotation>180.0, 90.0, 90.0</rotation>
        </object>
    </content>
</universe>
